number,value,datetime_start,datetime_complete,duration,params_batch_size,params_channels,params_dropout,params_lr,params_weight_decay,system_attrs_tpe:relative_params:0,state
0,0.9959238829445515,2026-10-04 10:52:59.857263,2026-10-04 10:53:55.757685,0 days 00:00:55.900422,32,deep_narrow,0.3005575058716044,0.0003574712922600243,0.0006796578090758161,,COMPLETE
1,0.9945650568601389,2026-10-04 10:53:56.254282,2026-10-04 10:54:32.246887,0 days 00:00:35.992605,32,deep_narrow,0.21597250932105788,0.00010725209743172001,1.461896279370496e-05,,COMPLETE
2,0.9945652173913043,2026-10-04 10:54:32.642454,2026-10-04 10:55:13.262041,0 days 00:00:40.619587,128,medium,0.29620728443102123,0.0008012737503998541,1.5339162591163623e-06,,COMPLETE
3,0.9959238829445515,2026-10-04 10:55:13.779908,2026-10-04 10:55:48.131759,0 days 00:00:34.351851,128,small,0.34211651325607845,0.0007896186801026692,5.762487216478604e-05,,COMPLETE
4,0.9945652173913043,2026-10-04 10:55:48.551225,2026-10-04 10:56:25.352461,0 days 00:00:36.801236,128,medium,0.2733551396716398,0.00015144860262751404,5.4880470007660465e-06,,COMPLETE
5,0.9741198568904934,2026-10-04 10:56:25.756449,2026-10-04 10:56:43.460848,0 days 00:00:17.704399,64,medium,0.022613644455269033,0.0027051668818999287,2.0013420622879995e-05,,PRUNED
6,0.9986412943148505,2026-10-04 10:56:43.980604,2026-10-04 10:57:19.766470,0 days 00:00:35.785866,32,deep_narrow,0.06125761383416495,0.0005632645552123538,0.002593512915428136,"{""batch_size"": 32, ""channels"": ""deep_narrow"", ""dropout"": 0.06125761383416495, ""lr"": 0.0005632645552123538, ""weight_decay"": 0.002593512915428136}",COMPLETE
7,0.9986412943148505,2026-10-04 10:57:20.183372,2026-10-04 10:57:55.805136,0 days 00:00:35.621764,32,deep_narrow,0.14268678132399704,0.002314741389293175,0.0036937678270560857,"{""batch_size"": 32, ""channels"": ""deep_narrow"", ""dropout"": 0.14268678132399704, ""lr"": 0.002314741389293175, ""weight_decay"": 0.0036937678270560857}",COMPLETE
8,0.9986412943148505,2026-10-04 10:57:56.230585,2026-10-04 10:58:31.902783,0 days 00:00:35.672198,32,small,0.062440248052381714,0.0003034884154362642,2.6646193471055327e-05,"{""batch_size"": 32, ""channels"": ""small"", ""dropout"": 0.062440248052381714, ""lr"": 0.0003034884154362642, ""weight_decay"": 2.6646193471055327e-05}",COMPLETE
9,0.9945577324625705,2026-10-04 10:58:32.316786,2026-10-04 10:58:59.554214,0 days 00:00:27.237428,32,deep_narrow,0.46525079088526194,0.0029534621353289017,5.041067035523245e-06,"{""batch_size"": 32, ""channels"": ""deep_narrow"", ""dropout"": 0.46525079088526194, ""lr"": 0.0029534621353289017, ""weight_decay"": 5.041067035523245e-06}",PRUNED
10,0.9029096908532356,2026-10-04 10:59:00.082393,2026-10-04 10:59:15.327365,0 days 00:00:15.244972,32,deep_narrow,0.431099840768806,0.0007662619156030758,0.0011307233371950524,"{""batch_size"": 32, ""channels"": ""deep_narrow"", ""dropout"": 0.431099840768806, ""lr"": 0.0007662619156030758, ""weight_decay"": 0.0011307233371950524}",PRUNED
11,0.9945652173913043,2026-10-04 10:59:15.718661,2026-10-04 10:59:47.027645,0 days 00:00:31.308984,32,deep_narrow,0.052546962284204024,0.0025304167971606315,0.0040880674488829325,"{""batch_size"": 32, ""channels"": ""deep_narrow"", ""dropout"": 0.052546962284204024, ""lr"": 0.0025304167971606315, ""weight_decay"": 0.0040880674488829325}",PRUNED
12,0.9823218148510627,2026-10-04 10:59:47.413451,2026-10-04 11:00:02.569561,0 days 00:00:15.156110,64,deep_narrow,0.20617673040432866,0.0017122896353000691,0.00448281232070338,"{""batch_size"": 64, ""channels"": ""deep_narrow"", ""dropout"": 0.20617673040432866, ""lr"": 0.0017122896353000691, ""weight_decay"": 0.00448281232070338}",PRUNED
13,0.9863896713298462,2026-10-04 11:00:02.962565,2026-10-04 11:00:20.330795,0 days 00:00:17.368230,32,deep_narrow,0.09267642646023724,0.00041760964435623936,0.00294053343891067,"{""batch_size"": 32, ""channels"": ""deep_narrow"", ""dropout"": 0.09267642646023724, ""lr"": 0.00041760964435623936, ""weight_decay"": 0.00294053343891067}",PRUNED
14,0.9972825284300695,2026-10-04 11:00:20.727910,2026-10-04 11:00:55.736075,0 days 00:00:35.008165,32,deep_narrow,0.015869893033724186,0.002270094042115547,0.0002873693888082036,"{""batch_size"": 32, ""channels"": ""deep_narrow"", ""dropout"": 0.015869893033724186, ""lr"": 0.002270094042115547, ""weight_decay"": 0.0002873693888082036}",COMPLETE
15,0.9932210108139787,2026-10-04 11:00:56.123881,2026-10-04 11:01:23.597766,0 days 00:00:27.473885,128,deep_narrow,0.05322602426044062,0.0006050756221877877,0.0002287298953017162,"{""batch_size"": 128, ""channels"": ""deep_narrow"", ""dropout"": 0.05322602426044062, ""lr"": 0.0006050756221877877, ""weight_decay"": 0.0002287298953017162}",PRUNED
16,0.9810678350467413,2026-10-04 11:01:23.990606,2026-10-04 11:01:39.318538,0 days 00:00:15.327932,32,deep_narrow,0.22724510654270358,0.0013688719026156975,0.00035638501781787887,"{""batch_size"": 32, ""channels"": ""deep_narrow"", ""dropout"": 0.22724510654270358, ""lr"": 0.0013688719026156975, ""weight_decay"": 0.00035638501781787887}",PRUNED
17,0.9675687672416701,2026-10-04 11:01:39.707479,2026-10-04 11:02:11.782690,0 days 00:00:32.075211,32,wide,0.10849450423154747,0.0011983407005777662,0.00011844111138704461,"{""batch_size"": 32, ""channels"": ""wide"", ""dropout"": 0.10849450423154747, ""lr"": 0.0011983407005777662, ""weight_decay"": 0.00011844111138704461}",PRUNED
18,0.9918475852902082,2026-10-04 11:02:12.167803,2026-10-04 11:02:38.443809,0 days 00:00:26.276006,32,small,0.13626663931779198,0.00015832209618905563,0.001186218794152227,"{""batch_size"": 32, ""channels"": ""small"", ""dropout"": 0.13626663931779198, ""lr"": 0.00015832209618905563, ""weight_decay"": 0.001186218794152227}",PRUNED
19,0.9646262969371686,2026-10-04 11:02:38.841613,2026-10-04 11:02:54.095776,0 days 00:00:15.254163,128,deep_narrow,0.19208479585617982,0.0005304067685794076,0.0036749919725301682,"{""batch_size"": 128, ""channels"": ""deep_narrow"", ""dropout"": 0.19208479585617982, ""lr"": 0.0005304067685794076, ""weight_decay"": 0.0036749919725301682}",PRUNED
20,0.9607642569184414,2026-10-04 11:02:54.498251,2026-10-04 11:03:23.691275,0 days 00:00:29.193024,32,medium,0.25706642705935684,0.0027571166296919527,0.001112145151967,"{""batch_size"": 32, ""channels"": ""medium"", ""dropout"": 0.25706642705935684, ""lr"": 0.0027571166296919527, ""weight_decay"": 0.001112145151967}",PRUNED
21,0.9864094306733241,2026-10-04 11:03:24.199210,2026-10-04 11:03:40.488787,0 days 00:00:16.289577,32,small,0.0240487940850206,0.00040922781221641166,1.423521172014334e-06,"{""batch_size"": 32, ""channels"": ""small"", ""dropout"": 0.0240487940850206, ""lr"": 0.00040922781221641166, ""weight_decay"": 1.423521172014334e-06}",PRUNED
22,1.0,2026-10-04 11:03:40.875205,2026-10-04 11:04:13.690722,0 days 00:00:32.815517,32,small,0.11299312390843377,0.00029424149348354894,1.1698032759430235e-05,"{""batch_size"": 32, ""channels"": ""small"", ""dropout"": 0.11299312390843377, ""lr"": 0.00029424149348354894, ""weight_decay"": 1.1698032759430235e-05}",COMPLETE
23,0.9986412943148505,2026-10-04 11:04:14.076023,2026-10-04 11:04:50.957993,0 days 00:00:36.881970,64,deep_narrow,0.05884377000430534,0.0010415640433692566,0.0077277980383094694,"{""batch_size"": 64, ""channels"": ""deep_narrow"", ""dropout"": 0.05884377000430534, ""lr"": 0.0010415640433692566, ""weight_decay"": 0.0077277980383094694}",COMPLETE
24,0.9768647814227925,2026-10-04 11:04:51.359097,2026-10-04 11:05:07.441914,0 days 00:00:16.082817,32,deep_narrow,0.02312290585828218,0.0001779502645972552,3.1855670816392146e-06,"{""batch_size"": 32, ""channels"": ""deep_narrow"", ""dropout"": 0.02312290585828218, ""lr"": 0.0001779502645972552, ""weight_decay"": 3.1855670816392146e-06}",PRUNED
